{"apiVersion":"devrelay.dev/v1alpha1","diagnostics":[],"evidence":[{"artifact":{"artifactId":"EEB-ATT-MQ-EVIDENCE-SEAL-002","digest":"sha256:173265f4e85fd81c356f9f52da15afee68ca5fd460b641309660d19874b1c323","mediaType":"application/vnd.devrelay.execution-evidence-bundle+json","schema":"https://devrelay.dev/artifacts/execution-evidence-bundle/v1","uri":"memory://devrelay/artifacts/EEB-ATT-MQ-EVIDENCE-SEAL-002/173265f4e85fd81c356f9f52da15afee68ca5fd460b641309660d19874b1c323.json"},"kind":"work-execution/raw-evidence","status":"pass","subject":"ATT-MQ-EVIDENCE-SEAL-002"}],"invocationId":"WE-V011-WI-MQ-EVIDENCE-SEAL-002","kind":"ModuleResult","outcome":"proposed","outputs":{"change-set-draft":[{"artifactId":"CS-ATT-MQ-EVIDENCE-SEAL-002","digest":"sha256:aded85f14cf89afe1879537e7b3fa4769d8931cf7a6feb614656de36b7386154","mediaType":"application/vnd.devrelay.change-set-draft+json","schema":"https://devrelay.dev/artifacts/change-set-draft/v1","uri":"memory://devrelay/artifacts/CS-ATT-MQ-EVIDENCE-SEAL-002/aded85f14cf89afe1879537e7b3fa4769d8931cf7a6feb614656de36b7386154.json"}],"execution-attempt":[{"artifactId":"ATT-MQ-EVIDENCE-SEAL-002","digest":"sha256:e033765cfcc810b22175ac2347bafb0cf232c0583af92930e219137c7d200cd8","mediaType":"application/vnd.devrelay.execution-attempt+json","schema":"https://devrelay.dev/artifacts/execution-attempt/v1","uri":"memory://devrelay/artifacts/ATT-MQ-EVIDENCE-SEAL-002/e033765cfcc810b22175ac2347bafb0cf232c0583af92930e219137c7d200cd8.json"}],"execution-evidence-bundle":[{"artifactId":"EEB-ATT-MQ-EVIDENCE-SEAL-002","digest":"sha256:173265f4e85fd81c356f9f52da15afee68ca5fd460b641309660d19874b1c323","mediaType":"application/vnd.devrelay.execution-evidence-bundle+json","schema":"https://devrelay.dev/artifacts/execution-evidence-bundle/v1","uri":"memory://devrelay/artifacts/EEB-ATT-MQ-EVIDENCE-SEAL-002/173265f4e85fd81c356f9f52da15afee68ca5fd460b641309660d19874b1c323.json"}]},"status":"completed"}
