{"apiVersion":"devrelay.dev/v1alpha1","diagnostics":[],"evidence":[{"artifact":{"artifactId":"EEB-ATT-PM-REGRESSION-PERFORMANCE-003","digest":"sha256:b26aaf6afc5fc8949076d986a24ee130c84d39c0348b947828f0abe9ab537ba6","mediaType":"application/vnd.devrelay.execution-evidence-bundle+json","schema":"https://devrelay.dev/artifacts/execution-evidence-bundle/v1","uri":"memory://devrelay/artifacts/EEB-ATT-PM-REGRESSION-PERFORMANCE-003/b26aaf6afc5fc8949076d986a24ee130c84d39c0348b947828f0abe9ab537ba6.json"},"kind":"work-execution/raw-evidence","status":"pass","subject":"ATT-PM-REGRESSION-PERFORMANCE-003"}],"invocationId":"WE-PM-001-WI-PM-REGRESSION-PERFORMANCE-ATT-003","kind":"ModuleResult","outcome":"proposed","outputs":{"change-set-draft":[{"artifactId":"CS-ATT-PM-REGRESSION-PERFORMANCE-003","digest":"sha256:83c38151658d6acfe2cad31a6d41d7056cb9087bfb4ed69f2adbf08ad83854ec","mediaType":"application/vnd.devrelay.change-set-draft+json","schema":"https://devrelay.dev/artifacts/change-set-draft/v1","uri":"memory://devrelay/artifacts/CS-ATT-PM-REGRESSION-PERFORMANCE-003/83c38151658d6acfe2cad31a6d41d7056cb9087bfb4ed69f2adbf08ad83854ec.json"}],"execution-attempt":[{"artifactId":"ATT-PM-REGRESSION-PERFORMANCE-003","digest":"sha256:6c15cc01e5016abfccf411c103fe2182766c34145ec83a7ac3a1f8e080c5ba06","mediaType":"application/vnd.devrelay.execution-attempt+json","schema":"https://devrelay.dev/artifacts/execution-attempt/v1","uri":"memory://devrelay/artifacts/ATT-PM-REGRESSION-PERFORMANCE-003/6c15cc01e5016abfccf411c103fe2182766c34145ec83a7ac3a1f8e080c5ba06.json"}],"execution-evidence-bundle":[{"artifactId":"EEB-ATT-PM-REGRESSION-PERFORMANCE-003","digest":"sha256:b26aaf6afc5fc8949076d986a24ee130c84d39c0348b947828f0abe9ab537ba6","mediaType":"application/vnd.devrelay.execution-evidence-bundle+json","schema":"https://devrelay.dev/artifacts/execution-evidence-bundle/v1","uri":"memory://devrelay/artifacts/EEB-ATT-PM-REGRESSION-PERFORMANCE-003/b26aaf6afc5fc8949076d986a24ee130c84d39c0348b947828f0abe9ab537ba6.json"}]},"status":"completed"}
