{"apiVersion":"devrelay.dev/v1alpha1","diagnostics":[],"evidence":[{"artifact":{"artifactId":"CI-INV-WI-REL-GITHUB-AUTOMATION-001:integrated","digest":"sha256:7e86ee9c6829f7b1b1dea4f0654255fbfd0a9af4ebd24896c7dbe1984e9e04da","mediaType":"application/vnd.devrelay.integrated-change-record+json","schema":"https://devrelay.dev/contracts/change-integration-artifacts.schema.json#/$defs/integratedRecord","uri":"memory://devrelay/integration/CI-INV-WI-REL-GITHUB-AUTOMATION-001%3Aintegrated/7e86ee9c6829f7b1b1dea4f0654255fbfd0a9af4ebd24896c7dbe1984e9e04da"},"kind":"change-integration/native-effect","status":"pass","subject":"CI-INV-WI-REL-GITHUB-AUTOMATION-001:integrated","summary":"persisted integration record binds replay and incorporation evidence"},{"artifact":{"artifactId":"POST-WI-REL-GITHUB-AUTOMATION","digest":"sha256:cf2d377869f3e0881ff2e6f23c95c213eb7128819415742c29509c3653b188ac","mediaType":"application/vnd.devrelay.repository-snapshot+json","schema":"https://devrelay.dev/artifacts/repository-snapshot/v1","uri":"memory://devrelay/integration/POST-WI-REL-GITHUB-AUTOMATION/cf2d377869f3e0881ff2e6f23c95c213eb7128819415742c29509c3653b188ac"},"kind":"change-integration/post-state","status":"pass","subject":"POST-WI-REL-GITHUB-AUTOMATION","summary":"persisted current repository snapshot matches evidenced post-state"}],"invocationId":"CI-INV-WI-REL-GITHUB-AUTOMATION-001","kind":"ModuleResult","outcome":"integrated","outputs":{"integrated-change-record":[{"artifactId":"CI-INV-WI-REL-GITHUB-AUTOMATION-001:integrated","digest":"sha256:7e86ee9c6829f7b1b1dea4f0654255fbfd0a9af4ebd24896c7dbe1984e9e04da","mediaType":"application/vnd.devrelay.integrated-change-record+json","schema":"https://devrelay.dev/contracts/change-integration-artifacts.schema.json#/$defs/integratedRecord","uri":"memory://devrelay/integration/CI-INV-WI-REL-GITHUB-AUTOMATION-001%3Aintegrated/7e86ee9c6829f7b1b1dea4f0654255fbfd0a9af4ebd24896c7dbe1984e9e04da"}],"repository-snapshot":[{"artifactId":"POST-WI-REL-GITHUB-AUTOMATION","digest":"sha256:cf2d377869f3e0881ff2e6f23c95c213eb7128819415742c29509c3653b188ac","mediaType":"application/vnd.devrelay.repository-snapshot+json","schema":"https://devrelay.dev/artifacts/repository-snapshot/v1","uri":"memory://devrelay/integration/POST-WI-REL-GITHUB-AUTOMATION/cf2d377869f3e0881ff2e6f23c95c213eb7128819415742c29509c3653b188ac"}]},"status":"completed"}
