{
  "apiVersion": "devrelay.dev/v1alpha1",
  "kind": "ModuleResult",
  "invocationId": "invocation-requirements-specialist-assignment-openspec-resume-v1",
  "status": "completed",
  "outcome": "change_set_drafted",
  "outputs": {
    "requirements-change-set": [
      {
        "artifactId": "requirements-change-set-specialist-assignment-v1",
        "schema": "https://devrelay.dev/artifacts/requirements-change-set/v1",
        "mediaType": "application/vnd.devrelay.requirements-change-set+json",
        "digest": "sha256:4700627a077896061e70027977de0efff90f072ba57910f04bfac69aa454d5dd",
        "uri": "file:///C:/repos/DevRelay/dogfood/specialist-assignment/requirements-change-set.json"
      }
    ],
    "project-overview-change-set-draft": [
      {
        "artifactId": "project-overview-change-set-specialist-assignment-v1",
        "schema": "https://devrelay.dev/artifacts/project-overview-change-set-draft/v1",
        "mediaType": "application/vnd.devrelay.project-overview-change-set-draft+json",
        "digest": "sha256:3b7ce8a5417eb74be3847ac0581bebdddf14b6a2f7e12b2aca9d7fc1baf10466",
        "uri": "file:///C:/repos/DevRelay/dogfood/specialist-assignment/project-overview-change-set-draft.json"
      }
    ],
    "native-source-bundle": [
      {
        "artifactId": "native-source-bundle-specialist-assignment-v1",
        "schema": "https://devrelay.dev/artifacts/native-source-bundle/v1",
        "mediaType": "application/vnd.devrelay.native-source-bundle+json",
        "digest": "sha256:ef6c13bc50ff7ae78eef978a441a586e76dd8e53e9fe74089928f8a91d192c50",
        "uri": "file:///C:/repos/DevRelay/dogfood/specialist-assignment/native-source-bundle.json"
      }
    ]
  },
  "evidence": [
    {
      "kind": "requirements/source-provenance",
      "subject": "requirements-change-set:requirements-change-set-specialist-assignment-v1",
      "status": "pass",
      "artifact": {
        "artifactId": "native-source-bundle-specialist-assignment-v1",
        "schema": "https://devrelay.dev/artifacts/native-source-bundle/v1",
        "mediaType": "application/vnd.devrelay.native-source-bundle+json",
        "digest": "sha256:ef6c13bc50ff7ae78eef978a441a586e76dd8e53e9fe74089928f8a91d192c50",
        "uri": "file:///C:/repos/DevRelay/dogfood/specialist-assignment/native-source-bundle.json"
      },
      "summary": "The exact owner response, bounded OpenSpec proposal, and specification normalize to the canonical paired change outputs."
    }
  ],
  "diagnostics": []
}
