{
  "apiVersion": "devrelay.dev/v1alpha1",
  "kind": "ModuleResult",
  "invocationId": "architecture-design-dg1-prefix-integrity-repair",
  "status": "completed",
  "outcome": "change_set_drafted",
  "outputs": {
    "architecture-change-set-draft": [
      {
        "artifactId": "architecture-change-set-dg1-prefix-integrity-repair",
        "schema": "https://devrelay.dev/artifacts/architecture-change-set-draft/v1",
        "mediaType": "application/vnd.devrelay.architecture-change-set-draft+json",
        "digest": "sha256:7210022b0ed8ab5bbf1aca80319b13ac96006a7851ab086d56f26c74052e4b17",
        "uri": "file:///C:/repos/DevRelay/dogfood/bootstrap-architecture-host-executor-adapters/dg1-continuation/architecture-change-set-draft.json"
      }
    ]
  },
  "evidence": [
    {
      "kind": "architecture/chain-provenance",
      "subject": "architecture-change-set-draft:architecture-change-set-dg1-prefix-integrity-repair",
      "status": "pass",
      "artifact": {
        "artifactId": "architecture-change-set-dg1-prefix-integrity-repair",
        "schema": "https://devrelay.dev/artifacts/architecture-change-set-draft/v1",
        "mediaType": "application/vnd.devrelay.architecture-change-set-draft+json",
        "digest": "sha256:7210022b0ed8ab5bbf1aca80319b13ac96006a7851ab086d56f26c74052e4b17",
        "uri": "file:///C:/repos/DevRelay/dogfood/bootstrap-architecture-host-executor-adapters/dg1-continuation/architecture-change-set-draft.json"
      },
      "summary": "The three new bounded host executors ran in exact Core order."
    },
    {
      "kind": "architecture/contract-validation",
      "subject": "architecture-change-set-draft:architecture-change-set-dg1-prefix-integrity-repair",
      "status": "pass",
      "artifact": {
        "artifactId": "architecture-change-set-dg1-prefix-integrity-repair",
        "schema": "https://devrelay.dev/artifacts/architecture-change-set-draft/v1",
        "mediaType": "application/vnd.devrelay.architecture-change-set-draft+json",
        "digest": "sha256:7210022b0ed8ab5bbf1aca80319b13ac96006a7851ab086d56f26c74052e4b17",
        "uri": "file:///C:/repos/DevRelay/dogfood/bootstrap-architecture-host-executor-adapters/dg1-continuation/architecture-change-set-draft.json"
      },
      "summary": "Canonical architecture runtime contracts validated the task-local candidate."
    }
  ],
  "diagnostics": []
}
