{"apiVersion":"devrelay.dev/v1alpha1","diagnostics":[],"evidence":[{"artifact":{"artifactId":"CI-INV-WI-REL-ACCEPTANCE-001:integrated","digest":"sha256:473d5626fd5d39d907ce13bbdf246bb1613d4e95198de4d15f84cae3e84728bf","mediaType":"application/vnd.devrelay.integrated-change-record+json","schema":"https://devrelay.dev/contracts/change-integration-artifacts.schema.json#/$defs/integratedRecord","uri":"memory://devrelay/integration/CI-INV-WI-REL-ACCEPTANCE-001%3Aintegrated/473d5626fd5d39d907ce13bbdf246bb1613d4e95198de4d15f84cae3e84728bf"},"kind":"change-integration/native-effect","status":"pass","subject":"CI-INV-WI-REL-ACCEPTANCE-001:integrated","summary":"persisted integration record binds replay and incorporation evidence"},{"artifact":{"artifactId":"POST-WI-REL-ACCEPTANCE","digest":"sha256:382c312e4d3dd06e7285d73c2aaf12ad23c9d6c3cae20307f8279ae80caf4b12","mediaType":"application/vnd.devrelay.repository-snapshot+json","schema":"https://devrelay.dev/artifacts/repository-snapshot/v1","uri":"memory://devrelay/integration/POST-WI-REL-ACCEPTANCE/382c312e4d3dd06e7285d73c2aaf12ad23c9d6c3cae20307f8279ae80caf4b12"},"kind":"change-integration/post-state","status":"pass","subject":"POST-WI-REL-ACCEPTANCE","summary":"persisted current repository snapshot matches evidenced post-state"}],"invocationId":"CI-INV-WI-REL-ACCEPTANCE-001","kind":"ModuleResult","outcome":"integrated","outputs":{"integrated-change-record":[{"artifactId":"CI-INV-WI-REL-ACCEPTANCE-001:integrated","digest":"sha256:473d5626fd5d39d907ce13bbdf246bb1613d4e95198de4d15f84cae3e84728bf","mediaType":"application/vnd.devrelay.integrated-change-record+json","schema":"https://devrelay.dev/contracts/change-integration-artifacts.schema.json#/$defs/integratedRecord","uri":"memory://devrelay/integration/CI-INV-WI-REL-ACCEPTANCE-001%3Aintegrated/473d5626fd5d39d907ce13bbdf246bb1613d4e95198de4d15f84cae3e84728bf"}],"repository-snapshot":[{"artifactId":"POST-WI-REL-ACCEPTANCE","digest":"sha256:382c312e4d3dd06e7285d73c2aaf12ad23c9d6c3cae20307f8279ae80caf4b12","mediaType":"application/vnd.devrelay.repository-snapshot+json","schema":"https://devrelay.dev/artifacts/repository-snapshot/v1","uri":"memory://devrelay/integration/POST-WI-REL-ACCEPTANCE/382c312e4d3dd06e7285d73c2aaf12ad23c9d6c3cae20307f8279ae80caf4b12"}]},"status":"completed"}
