{"apiVersion":"devrelay.dev/v1alpha1","diagnostics":[],"evidence":[{"artifact":{"artifactId":"EEB-ATT-RP-WINDOWS-E2E-001","digest":"sha256:ebba7d4a36aa87c9fa5a126ea9c9c2630685519bb7bbc6086fabe5337dd00c50","mediaType":"application/vnd.devrelay.execution-evidence-bundle+json","schema":"https://devrelay.dev/artifacts/execution-evidence-bundle/v1","uri":"memory://devrelay/artifacts/EEB-ATT-RP-WINDOWS-E2E-001/ebba7d4a36aa87c9fa5a126ea9c9c2630685519bb7bbc6086fabe5337dd00c50.json"},"kind":"work-execution/raw-evidence","status":"pass","subject":"ATT-RP-WINDOWS-E2E-001"}],"invocationId":"WE-RP-001-WI-RP-WINDOWS-E2E","kind":"ModuleResult","outcome":"proposed","outputs":{"change-set-draft":[{"artifactId":"CS-ATT-RP-WINDOWS-E2E-001","digest":"sha256:7d206244a04406f6086ad2d222e9b3a19f471db3bb046be8ee48acd8353c8c52","mediaType":"application/vnd.devrelay.change-set-draft+json","schema":"https://devrelay.dev/artifacts/change-set-draft/v1","uri":"memory://devrelay/artifacts/CS-ATT-RP-WINDOWS-E2E-001/7d206244a04406f6086ad2d222e9b3a19f471db3bb046be8ee48acd8353c8c52.json"}],"execution-attempt":[{"artifactId":"ATT-RP-WINDOWS-E2E-001","digest":"sha256:70de46213badfa995de9abcdf2cab7b747986c0ca0738725e81e2262d5c316ba","mediaType":"application/vnd.devrelay.execution-attempt+json","schema":"https://devrelay.dev/artifacts/execution-attempt/v1","uri":"memory://devrelay/artifacts/ATT-RP-WINDOWS-E2E-001/70de46213badfa995de9abcdf2cab7b747986c0ca0738725e81e2262d5c316ba.json"}],"execution-evidence-bundle":[{"artifactId":"EEB-ATT-RP-WINDOWS-E2E-001","digest":"sha256:ebba7d4a36aa87c9fa5a126ea9c9c2630685519bb7bbc6086fabe5337dd00c50","mediaType":"application/vnd.devrelay.execution-evidence-bundle+json","schema":"https://devrelay.dev/artifacts/execution-evidence-bundle/v1","uri":"memory://devrelay/artifacts/EEB-ATT-RP-WINDOWS-E2E-001/ebba7d4a36aa87c9fa5a126ea9c9c2630685519bb7bbc6086fabe5337dd00c50.json"}]},"status":"completed"}
