{
  "apiVersion": "devrelay.dev/v1alpha1",
  "kind": "ModuleResult",
  "invocationId": "invocation-requirements-rp-001-release-preparation-openspec-v1",
  "status": "completed",
  "outcome": "change_set_drafted",
  "outputs": {
    "requirements-change-set": [
      {
        "artifactId": "requirements-change-set-rp-001-release-preparation-v1",
        "schema": "https://devrelay.dev/artifacts/requirements-change-set/v1",
        "mediaType": "application/vnd.devrelay.requirements-change-set+json",
        "digest": "sha256:310ad9211e36401455f29c359e6e2603436a906a7ae35bcc93914fc0db7c8b2e",
        "uri": "file:///C:/repos/DevRelay/dogfood/rp-001-release-preparation/requirements-change-set.json"
      }
    ],
    "project-overview-change-set-draft": [
      {
        "artifactId": "project-overview-change-set-rp-001-release-preparation-v1",
        "schema": "https://devrelay.dev/artifacts/project-overview-change-set-draft/v1",
        "mediaType": "application/vnd.devrelay.project-overview-change-set-draft+json",
        "digest": "sha256:f17796cc7f387d811bfdfeb96564c582296573c3be1bd2850e4ff08f13aabf16",
        "uri": "file:///C:/repos/DevRelay/dogfood/rp-001-release-preparation/project-overview-change-set-draft.json"
      }
    ],
    "native-source-bundle": [
      {
        "artifactId": "native-source-bundle-rp-001-release-preparation-v1",
        "schema": "https://devrelay.dev/artifacts/native-source-bundle/v1",
        "mediaType": "application/vnd.devrelay.native-source-bundle+json",
        "digest": "sha256:b6c3005c8da6eef4b5f04bbab4e0659bf6ad163668692a9da7cc2e122cdd2179",
        "uri": "file:///C:/repos/DevRelay/dogfood/rp-001-release-preparation/native-source-bundle.json"
      }
    ]
  },
  "evidence": [
    {
      "kind": "requirements/source-provenance",
      "subject": "requirements-change-set:requirements-change-set-rp-001-release-preparation-v1",
      "status": "pass",
      "artifact": {
        "artifactId": "native-source-bundle-rp-001-release-preparation-v1",
        "schema": "https://devrelay.dev/artifacts/native-source-bundle/v1",
        "mediaType": "application/vnd.devrelay.native-source-bundle+json",
        "digest": "sha256:b6c3005c8da6eef4b5f04bbab4e0659bf6ad163668692a9da7cc2e122cdd2179",
        "uri": "file:///C:/repos/DevRelay/dogfood/rp-001-release-preparation/native-source-bundle.json"
      },
      "summary": "The exact owner-approved wave and bounded OpenSpec artifacts normalize to one canonical paired requirements and ProjectOverview change candidate."
    }
  ],
  "diagnostics": []
}
