{"apiVersion":"devrelay.dev/v1alpha1","diagnostics":[],"evidence":[{"artifact":{"artifactId":"EEB-ATT-PM-WINDOWS-E2E-004","digest":"sha256:b8c75967a1ca1f4974a4c00d92f68aa2ec39ee3334093afa4d2d2c3151d34bd3","mediaType":"application/vnd.devrelay.execution-evidence-bundle+json","schema":"https://devrelay.dev/artifacts/execution-evidence-bundle/v1","uri":"memory://devrelay/artifacts/EEB-ATT-PM-WINDOWS-E2E-004/b8c75967a1ca1f4974a4c00d92f68aa2ec39ee3334093afa4d2d2c3151d34bd3.json"},"kind":"work-execution/raw-evidence","status":"pass","subject":"ATT-PM-WINDOWS-E2E-004"}],"invocationId":"WE-PM-001-WI-PM-WINDOWS-E2E-ATT-001","kind":"ModuleResult","outcome":"proposed","outputs":{"change-set-draft":[{"artifactId":"CS-ATT-PM-WINDOWS-E2E-004","digest":"sha256:3124ede68c0e50965158cc40cd9687224a2ea8e13ee81747a1b8065e790448de","mediaType":"application/vnd.devrelay.change-set-draft+json","schema":"https://devrelay.dev/artifacts/change-set-draft/v1","uri":"memory://devrelay/artifacts/CS-ATT-PM-WINDOWS-E2E-004/3124ede68c0e50965158cc40cd9687224a2ea8e13ee81747a1b8065e790448de.json"}],"execution-attempt":[{"artifactId":"ATT-PM-WINDOWS-E2E-004","digest":"sha256:9ef8aa43fb9ff0e9d0e020624b033496442a7b7057926bf3792e1ef250398219","mediaType":"application/vnd.devrelay.execution-attempt+json","schema":"https://devrelay.dev/artifacts/execution-attempt/v1","uri":"memory://devrelay/artifacts/ATT-PM-WINDOWS-E2E-004/9ef8aa43fb9ff0e9d0e020624b033496442a7b7057926bf3792e1ef250398219.json"}],"execution-evidence-bundle":[{"artifactId":"EEB-ATT-PM-WINDOWS-E2E-004","digest":"sha256:b8c75967a1ca1f4974a4c00d92f68aa2ec39ee3334093afa4d2d2c3151d34bd3","mediaType":"application/vnd.devrelay.execution-evidence-bundle+json","schema":"https://devrelay.dev/artifacts/execution-evidence-bundle/v1","uri":"memory://devrelay/artifacts/EEB-ATT-PM-WINDOWS-E2E-004/b8c75967a1ca1f4974a4c00d92f68aa2ec39ee3334093afa4d2d2c3151d34bd3.json"}]},"status":"completed"}
